MCQ,Choices,Correct
What is the scientific study of life called?,a: Chemistry | b: Biology | c: Physics | d: Geology,b
Which theme in biology explains the unity and diversity of life?,a: Evolution | b: Energy processing | c: Cellular organization | d: Homeostasis,a
What is the main unit of life that processes hereditary information?,a: Atoms | b: Molecules | c: Cells | d: Tissues,c
Which level of organization in biology studies the anatomy and physiology of plants and animals?,a: Molecular biology | b: Ecology | c: Organismal biology | d: Population biology,c
When did life on Earth emerge?,a: 2.5 billion years ago | b: 4.2 billion years ago | c: 3.7 billion years ago | d: 5.0 billion years ago,c
